Denominazione,Indirizzo,CAP,Comune,Provincia,Regione,Codice_univoco,Partita_IVA
Farmacia Sa.na.,"Via Di Vermicino, 563",00133,Roma,Roma (RM),Lazio,F/19826,14331961004
"Sede Farmaceutica N.846 ""Pietro Lusetti""",Via Della Giustiniana 154/d,00188,Roma,Roma (RM),Lazio,F/19835,14262291009
Farmacia La Nave S.n.c. Dei Dottori Morganti Chiara E Iacomelli Andrea,P.zza Sandro Pertini S.n.c.,00047,Marino,Roma (RM),Lazio,F/19838,14395691000
Farmacia Torrenova S.a.s. Della Dott.ssa Caterina Mattia,"Via Di Torrenova, 78",00133,Roma,Roma (RM),Lazio,F/19579,14211911004
Isola Sacra S.a.s. Di Leonella Angeli Bufalini,"Via Trincea Delle Frasche, 161",00054,Fiumicino,Roma (RM),Lazio,F/19593,14191931006
Farmacia Hermes Snc Dei Dottori Pisapia Ida E Fierro Ernesto,"Via Costantino, 16-18-20",00012,Guidonia montecelio,Roma (RM),Lazio,F/19724,14358061001
Farmacia Sant'Anna Dei Dott.ri Baldinelli Alessandra E Santarelli Federico S.n.c.,"Via A. Manzoni, 2",00011,Tivoli,Roma (RM),Lazio,F/19721,14240551003
Farmacia Montelarco S.n.c. Di Angela Andreina Maria Versaci E Debora Anfora,"Via Flaminia, Km 33,600",00068,Rignano flaminio,Roma (RM),Lazio,F/18468,14453831001
"Farmacia Gem Al Gesu' Operaio Dei Dottori Giuseppina Andreano, Mi Chele Incecchi Ed Elena Martines S.n.c.","Via Piave, 18 D/e/f",00015,Monterotondo,Roma (RM),Lazio,F/19459,14148881007
Farmacia Valle Santa S.n.c. Dei Dottori Casarella Vincenzo E Grimaldi Anna,"Via Di Boccea, 1056",00166,Roma,Roma (RM),Lazio,F/19467,14233681007
"Farmacia Porta Di Roma Snc Dei Dottori Ma Riapia Leggiero, Antonio Bellantoni E Salvatore Palmieri","Via Adolfo Celi, 65",00139,Roma,Roma (RM),Lazio,F/19468,14232461005
"Farmacia Infernetto Sas Delle Dottoresse Simona Goretti, A. Pizzuti E R. Pizzuti","Via Umberto Giordano, 93/a",00124,Roma,Roma (RM),Lazio,F/19469,14213651004
Farmacia Ss. Cosma E Damiano,Via Al Sesto Miglio 30/32,00189,Roma,Roma (RM),Lazio,F/19848,14251671005
Farmacia Cinque Miglia Sas Del Dr. Gaetano Mauro & C.,"Via Delle Cinque Miglia, Snc",00042,Anzio,Roma (RM),Lazio,F/19850,14429221006
Farmacia Armetta,Via Di Frascati 86,00078,Monte porzio catone,Roma (RM),Lazio,F/19851,14345381009
Farmacia Casal Del Marmo,Via Casal Del Marmo 201/203/205,00135,Roma,Roma (RM),Lazio,F/19872,14076491001
Farmacia San Martino,"Via San Martino, 221",00015,Monterotondo,Roma (RM),Lazio,F/19873,14509301009
"Farmacia Pantano S.n.c. Dei Dottori Daroui Reza, Hedayeti Hediehe Sarichelou Iran","Via Casilina, 24-28",00077,Montecompatri,Roma (RM),Lazio,F/19696,14262461008
Farmacia Dottori De Lillo Marco E De Lillo Paolo Arturo Snc,"Via Dei Mazzanti, 15",00148,Roma,Roma (RM),Lazio,F/19758,14088731006
Farmacia Guidonia,"Via Vittorio De Sica, 1",00012,Guidonia montecelio,Roma (RM),Lazio,F/19759,13968781008
"Farmacia Hermes S.n.c. Dei Dott.ri Lucia Minervini, Matilde Minervini E Rosario Musumeci",Via Di Casal Del Marmo 280,00135,Roma,Roma (RM),Lazio,F/19764,14285101003
Farmacia Torre Gaia S.n.c. Dei Dottori Stefano Carrino E Benito Paolantonio,Via Casilina 1585/b,00133,Roma,Roma (RM),Lazio,F/19775,14281711003
Farmacia Stazione,"Piazzale Scipione Matteuzzi, Snc",00053,Civitavecchia,Roma (RM),Lazio,F/19782,02700960582
Farmacia San Francesco S.n.c. Dei Dottori Bottoni Francesco E Ciancia Eleonora,"Via Nettunense, 228",00073,Castel gandolfo,Roma (RM),Lazio,F/19785,13948661007
Farmacia Statuario S.a.s. Della Dottoressa Rosa Luisi,"Via Squillace, 84,86 Ad Angolo Con Via Taurianova, 80, 82",00178,Roma,Roma (RM),Lazio,F/19787,14219651008
Farmacia Monte Caminetto S.a.s. Della Dottoressa Giorgia Botta,"Via Sacrofano Cassia, 5280",00060,Sacrofano,Roma (RM),Lazio,F/19821,14402991005
Farmacia Ramo D'Oro S.a.s. Di Tambone Francesco,Via Ramo D'Oro 9,00072,Ariccia,Roma (RM),Lazio,F/19822,14412591001
Farmacia Comunale Dott.d'Ortona Luca,"Via Giuseppe Garibaldi, 155",00076,Lariano,Roma (RM),Lazio,F/19823,14437691000
Farmacia Riace Del Dottor Roberto Splendiani & C. S.n.c.,"Via Anagnina, 470",00118,Roma,Roma (RM),Lazio,F/19479,14040591001
Farmacia Dei Velieri Snc,"Via Dei Velieri, 64-66",00121,Roma,Roma (RM),Lazio,F/19644,14165661001
Farmacia Messidoro S.n.c. Delle Dottoresse Daniela Mattiuzzo E Francesca Novarini,"Via Delle Messi D'Oro, 197",00158,Roma,Roma (RM),Lazio,F/19519,14205031009
Barberini Dr.i Gangemi Antonio E Rosa Snc,"Via A. Millevoi, 37",00143,Roma,Roma (RM),Lazio,F/18395,06096301004
Tioli Snc Dr.ssa Franca Aita E Dott. Andrea Babini,"Largo Brancaccio, 65/67",00184,Roma,Roma (RM),Lazio,F/9246,05418151006
Farmacia Parisi Dott. Alessandro,"Viale Vittorio Veneto, 100-102",00046,Grottaferrata,Roma (RM),Lazio,F/10031,02958900603
Farmacia Internazionale Snc Delle Dr.sse Flavia Giannini E Teresafabiola Miscioscia,"Viale Caduti Guerra Liberazione, 392",00128,Roma,Roma (RM),Lazio,F/19563,14184301001
Farmacia Silgre Della Dott.ssa Silvia Di Paolo & C. S.a.s.,"Via Siena, 6",00041,Albano laziale,Roma (RM),Lazio,F/19572,14286911004
Farmacia Fiume Giallo S.a.s.,"Via Fiume Giallo, 399/401",00144,Roma,Roma (RM),Lazio,F/19573,13905911007
"Farmacia Mezzocammino Snc Di Calabrese Giuseppe, Diego E Bordi Federica","Viale Gianluigi Bonelli, 84a/b/bi",00127,Roma,Roma (RM),Lazio,F/19574,14278851002
Farmacia Castel Di Leva Snc Delle Dr.sse Silvia Di Giammarino E Maria Lanotte,"Via Di Castel Di Leva, 263",00134,Roma,Roma (RM),Lazio,F/19498,14236161007
Farmacia Del Mare Dei Dottori Domenico D'Ambrosio E Elena Azzurro S.n.c.,"Via Di Torvaianica Alta, 23-25",00071,Pomezia,Roma (RM),Lazio,F/19499,13916741005
Farmacia Sacro Cuore S.n.c. Di Di Fraia Federica E Samperi Cristoforo,"Viale Marconi, 31",00042,Anzio,Roma (RM),Lazio,F/19489,14143311000
Armenio Fausto,"Via Parigi, 39",00055,Ladispoli,Roma (RM),Lazio,F/18019,09141751009
Mantoni Panimolle Della Dr.ssa Mantoni Paola E Del Dr.sergio Panimolle,"Via Dei Platani, 17 - 17/a",00013,Fonte nuova,Roma (RM),Lazio,F/17994,10880221006
Farmacia Assistenziale A.n.m.i.g.,"Lungotevere Castello, 2",00193,Roma,Roma (RM),Lazio,F/18075,02114911007
Pirillo Maria Cristina,"Via Landi, 57",00045,Genzano di roma,Roma (RM),Lazio,F/18013,04008360960
Lapucci Lorenzina,"Via Tiberina, 33",00065,Fiano romano,Roma (RM),Lazio,F/18053,06319231004
San Gaspare Del Bufalo Srl,"Via Roma, 23",00010,Marcellina,Roma (RM),Lazio,F/18317,10091791003
Farmacia Policlinico,"Via G.B. Morgagni, 30/C-30/D",00161,Roma,Roma (RM),Lazio,F/9099,08425831008
RE CLELIA,"Via Trionfale, 118",00195,Roma,Roma (RM),Lazio,F/9703,05868660589
LEODORI ROSARIA,"VIALE DEI PINI, 17",00030,Rocca santo stefano,Roma (RM),Lazio,F/9870,12921251000
GRIMALDI ENZO,"Viale Jonio, 235",00141,Roma,Roma (RM),Lazio,F/9163,02477800581
GUADAGNO ANGELO,"Via G. Curioni, 51/53",00157,Roma,Roma (RM),Lazio,F/9359,05708010581
GUARNACCI SNC DI LAURA GUARNACCI E GIULIA BARBIERI,"Via Flaminia, 5/7",00196,Roma,Roma (RM),Lazio,F/9165,10178441001
IACOVELLI SALVATORE,"Via Annia Regilla, 202",00178,Roma,Roma (RM),Lazio,F/9333,07419770586
TRE MADONNE,"Via Bertoloni, 5",00197,Roma,Roma (RM),Lazio,F/9229,12240221007
RESTAINO FELICE,"Piazza Aldo Moro, 15/16",00012,Guidonia montecelio,Roma (RM),Lazio,F/9905,00698771003
DEL LEONE SAS DI PONTECORVI ILARIA & C.,"Largo Beltramelli, 13 13/A",00157,Roma,Roma (RM),Lazio,F/9307,12524611006
ROANI SCIUTO ANDREINA,"Via Aurelia, 2835 (Km. 28)",00050,Fiumicino,Roma (RM),Lazio,F/9579,05587151001
ROMAGNOLI GIANNI,"Piazza Mazzini, 10",00030,Labico,Roma (RM),Lazio,F/9928,10178450580
SPINELLI MAURIZIO & C. SNC,"Via G. Ricci Curbastro, 3",00149,Roma,Roma (RM),Lazio,F/9566,10707381009
ROMANI ROBERTO,"Via Ettore Gabrielli, 43",00049,Velletri,Roma (RM),Lazio,F/9964,00447910589
SAN PIO DOTT.RISOLIMANDO PAOLINO SAS,"Via S. Bernadette, 55",00167,Roma,Roma (RM),Lazio,F/9681,12987941007
ROSSETTI SAS,"Via Maremmana Inferiore, 300",00012,Guidonia montecelio,Roma (RM),Lazio,F/9907,11993721007
ROSSI GIAMPIERO,"Via Edoardo Jenner, 109",00151,Roma,Roma (RM),Lazio,F/9616,09151300580
ROSSI GUENDALINA,"Viale Giulio Agricola, 96",00174,Roma,Roma (RM),Lazio,F/9343,08727940580
RUSSINO FRANCESCO,"Via Principe Eugenio, 53 - 55",00185,Roma,Roma (RM),Lazio,F/9270,06677401009
DE REMIGIS MAURIZIO LUCIANO,"Via Tiburtina, 608/D",00159,Roma,Roma (RM),Lazio,F/9367,13341481003
RUSSO LORETA,Viale Palmiro togliatti 944,00171,Roma,Roma (RM),Lazio,F/9294,01936510583
SABAUDIA DEL DR. MARCO MORI,"Via Sabaudia, 71",00171,Roma,Roma (RM),Lazio,F/9558,02151230444
SAGRIPANTI FRANCA,"Via Tuscolana, 1258",00174,Roma,Roma (RM),Lazio,F/9320,04970700581
SAN GIORGIO SNC,"Via di Macchia Saponara, 64/T",00125,Roma,Roma (RM),Lazio,F/9664,07029701005
FARMACIE SANASI GIUSSANO SAS DI SANASI ARMANDO CARMELO ANTONIO,"Via A. da Giussano, 40",00176,Roma,Roma (RM),Lazio,F/9474,11429971002
AXA MADONNETTA SAS DEL DR. RICCARDO SANSONI,"Via Cesare Maccari, 312",00125,Roma,Roma (RM),Lazio,F/17298,09258241000
SANTA RITA,"Viale XXI Aprile, 2e 2f",00162,Roma,Roma (RM),Lazio,F/9257,10844240589
SATULLI MARCO,"Corso Matteotti, 83/8",00041,Albano laziale,Roma (RM),Lazio,F/10024,04700991005
MORENA - DR. SACARNO SAS,"Via Stazione di Ciampino, 56-58",00118,Roma,Roma (RM),Lazio,F/9318,11496381002
PASSERINI NICOLA & C. SAS,"Via Cadorna, 31",00028,Subiaco,Roma (RM),Lazio,F/9865,13246871001
SEMPIONE SNC R. RINALDI E. RINALDI E F. SCARPELLINI,"Corso Sempione, 16",00141,Roma,Roma (RM),Lazio,F/9125,06645591006
SENATO,"Corso Rinascimento, 50",00186,Roma,Roma (RM),Lazio,F/9255,10772830583
SENESI DR. ALFREDO,"Via Col di Lana, 148/166",00043,Ciampino,Roma (RM),Lazio,F/10054,00182941005
LOMBARDI CHIARA,"Circonvallazione Ostiense, 142",00154,Roma,Roma (RM),Lazio,F/9461,13944501009
DI SIENA CINZIA,"Via Gino Capponi, 65",00179,Roma,Roma (RM),Lazio,F/9409,09483171006
PIGNATELLI FRANCESCO,"Via Aquila, snc",00060,Ponzano romano,Roma (RM),Lazio,F/9816,00922350574
SIMEONI ROBERTO,"Via Pio XII, 60",00033,Cave,Roma (RM),Lazio,F/9933,10374480589
SORRENTINO LUCIA,"Viale Rossini, 70/72",00198,Roma,Roma (RM),Lazio,F/9173,07097750587
"SPARTIVENTO SNC DEI DR.I BIANCAPAOLA PETTINELLA, LANZELLOTTI F. E F.","Via A. Piola Caselli, 82/b-c",00122,Roma,Roma (RM),Lazio,F/9580,07260581009
EMILIANI ANTONIO MARIA,"Via S. Elpidio a Mare, 21",00010,Roma,Roma (RM),Lazio,F/9330,07078810582
ANGELONI GIOVANNA,"Via La Spezia, 96/98",00182,Roma,Roma (RM),Lazio,F/9513,09016731003
EREDI DE LAURENZI DELLE DR.SSE ANNA E LUCIA PERETTI & C. SNC,"Via Mura dei Francesi, 23",00043,Ciampino,Roma (RM),Lazio,F/10042,05970251004
EREDI DI VINCENTI MARCELLO TOMMASO,"Piazza della Rovere, 2/C",00122,Roma,Roma (RM),Lazio,F/9651,07289721008
ROSA BARBARA,"Via Tommaso da Celano, 122",00179,Roma,Roma (RM),Lazio,F/9548,11151231005
EREDI ZAMPONI PAOLO MARIA,"Via dei Colombi, 84/A",00169,Roma,Roma (RM),Lazio,F/9400,07133761002
MITIDIERI ATTILIO,"Via Provinciale, 18",00060,Nazzano,Roma (RM),Lazio,F/9836,08723231000
PIAZZA REGINA MARGHERITA DEL DOTT. EMILIO MANFREDI,"Viale Regina Margherita, 221/223",00198,Roma,Roma (RM),Lazio,F/9097,11118071007
MINELLI SNC DEI DR.I GIOVANNA E MICHELE MINELLI,"Piazza Rivarola, 8",00019,Tivoli,Roma (RM),Lazio,F/9937,07745301007
MOLAJONI SNC-CLELIA & MARCO MOLAJONI,"Via dei Durantini, 350-350/a",00157,Roma,Roma (RM),Lazio,F/9363,04850871007
MOLINARI FRANCO,"Piazza Mazzini, 34",00049,Velletri,Roma (RM),Lazio,F/9978,00437731003
EREDI DR. G.C. MONTAGNA DI FEDERICA COLLEGATI E FRANCESCA MONTAGNA SNC,"Via C. Ricotti, 42",00159,Roma,Roma (RM),Lazio,F/9316,03445430584
MORREALE GIUSEPPE,"Via Tuscolana, 344",00181,Roma,Roma (RM),Lazio,F/9423,01275700589
MOSCA MASSIMO,"Via delle Galline Bianche, snc",00188,Roma,Roma (RM),Lazio,F/9770,10271290586
LORPHARMA SAS DI SAVERIO MOZZETTI & C.,"Via Donna Olimpia, 23",00152,Roma,Roma (RM),Lazio,F/9627,04571831009
LORPHARMA SAS DI MOZZETTI SAVERIO & C.,"Via Camillo Serafini, 28",00164,Roma,Roma (RM),Lazio,F/9592,02154810580
CELIMONTANA DI ROCCO POLIMENI,"Via Celimontana, 9/a",00184,Roma,Roma (RM),Lazio,F/9136,13208771009
NAZIONALE,"Via Augusto Lupi, 38/40",00169,Roma,Roma (RM),Lazio,F/9390,06077091004
NEGRI DR. MASSIMO,"Via Fausti, 5",00062,Bracciano,Roma (RM),Lazio,F/9804,13863571009
QUIRINALE DR.SSA NISI MARIA CRISTINA,"Via Milano, 54",00184,Roma,Roma (RM),Lazio,F/9152,05271620584
NOCERINO DOTT. GUIDO SNC,"Largo Giannina Milli, 17-18-18/a",00135,Roma,Roma (RM),Lazio,F/9695,13228671007
LA TORRACCIA SNC DI ORLANDI LUCIANA E CIDONIO GIOVANNA,"Via Donato Menichella, 132",00156,Roma,Roma (RM),Lazio,F/9326,08756111004
OSTIENSE SNC DI ANGELI MASSIMO E OLIVIERI ANTONIO,"Via Ostiense, 85-85/A",00154,Roma,Roma (RM),Lazio,F/9543,06023681007
COLLE AURELIO DOTT. IGNAZIO PAGANO MARIANO,"Via Baldo degli Ubaldi, 97",00167,Roma,Roma (RM),Lazio,F/9755,09868540585
FARMACIA DELLA STAZIONE Di PAGLIACCI PIERPAOLO,"Via Nettunense, 299",00040,Anzio,Roma (RM),Lazio,F/9999,13586091004
CALO' MICAELA,"Largo Esopo, 20",00124,Roma,Roma (RM),Lazio,F/9582,10698061008
PALOMBI DAVID,"Piazza S. Sebastiano, 12",00021,Affile,Roma (RM),Lazio,F/9858,00575751003
PALOMBO VINCENZO,"Corso Centocelle, 24/26",00053,Civitavecchia,Roma (RM),Lazio,F/9172,06994791009
PANGIA RAFFAELE VINCENZO,"Via F. Bulgarini, 28",00019,Tivoli,Roma (RM),Lazio,F/9934,05381141000
Passarella Nunziato,"Piazza Dante Alighieri, 9",00072,Ariccia,Roma (RM),Lazio,F/10049,03698800657
PASSARETTA ADA,"Via Enrico Fermi, 1/3/5",00146,Roma,Roma (RM),Lazio,F/9600,06214480581
SPINACETO SAS DELLA D.SSA MARIA RITA VIGLIOTTA & C.,"Viale Eroi di Cefalonia, 109",00128,Roma,Roma (RM),Lazio,F/9545,05990111006
TACCONI SILVIA,"Corso Trieste, 3",00047,Marino,Roma (RM),Lazio,F/9959,09587041006
TAGLIAVINI DI CIANCI FRANCESCA E GIUDITTA E C. SAS,"Via Priscilla, 77/79",00199,Roma,Roma (RM),Lazio,F/9113,13654031007
TERRONE SNC,"Piazza F. Patellani, snc",00038,Valmontone,Roma (RM),Lazio,F/9908,13264951008
EUROPA DI TIMPANO UGO & C. SNC,"Via Cicerone, 2",00042,Anzio,Roma (RM),Lazio,F/10010,03833781002
TONINELLI SIMONETTA,"Via A. Valenzani, 20",00187,Roma,Roma (RM),Lazio,F/9192,08393070589
TORELLI DEL DR. GUIDO TORELLI E C. SAS,"Via del Trullo, 294-296",00148,Roma,Roma (RM),Lazio,F/9563,09600211008
TORRESI EREDI DOTT. GIOVANNI TORRESI,"Via Cerveteri, 5/7/9/11",00183,Roma,Roma (RM),Lazio,F/9405,13878511008
TRECCA SNC DI FLAVIA E ILARIA MASTRANGELI,"Via Emanuele Filiberto, 145",00185,Roma,Roma (RM),Lazio,F/9145,13556491002
TURCO STEFANO,"Via Danimarca, 185/187",00040,Pomezia,Roma (RM),Lazio,F/10006,09101151000
SCACCIAPENSIERI,"Via della Liberazione, 78",00048,Nettuno,Roma (RM),Lazio,F/9990,07494501005
VALENTINI MASSIMO,"Via G.Antamoro, 86/b",00137,Roma,Roma (RM),Lazio,F/9114,00825481005
VALLE MASSIMO,"Via G. Ciaralli, 13",00156,Roma,Roma (RM),Lazio,F/9176,07293750589
VECCHIARINO GIUSEPPE,"Piazzale Giovanni XXIII, snc",00020,Cervara di roma,Roma (RM),Lazio,F/9953,07319041005
VILLAGGIO AZZURRO SNC DEL DR. MURDOCCO PAOLO & C.,"Largo Filippo Juvara, 5",00128,Roma,Roma (RM),Lazio,F/9462,07114990588
FARMACIA ZAFFIRI DEL DOTT. ZAFFIRI G.M. & C. SNC,"Via di Pietralata, 511",00158,Roma,Roma (RM),Lazio,F/9300,14102581007
ZANOBI AIDA,"Piazza A.F.Doria Pamphili, 14",00149,Roma,Roma (RM),Lazio,F/9584,03261470581
Ziaco Maria Pia,"Via Roma, 123",00040,Pomezia,Roma (RM),Lazio,F/10004,00847431004
ZUCCARELLO SALVATORE,"Via Gramsci, 42",00026,Licenza,Roma (RM),Lazio,F/9926,09931980586
FARMACIA PICONE DOTT.SSA ANNAPAOLA,"Via Romana, 165",00060,Mazzano romano,Roma (RM),Lazio,F/9806,02221490564
MAZZEI STEFANO,"Viale Angelico, 79",00195,Roma,Roma (RM),Lazio,F/9787,07104801001
TUPPUTI PAOLO,"Via Roberto Malatesta, 35",00176,Roma,Roma (RM),Lazio,F/9427,10417101002
MERULANA DI G. GUERRA-B. DEL PIO SNC,"Via Merulana, 185/187",00185,Roma,Roma (RM),Lazio,F/9211,04211761004
CASALBERTONE DELLA DR.SSA FILARDI GEMMA,"Via A. Baldissera, 1/c",00159,Roma,Roma (RM),Lazio,F/9317,13479801006
ROMANINA DELLA DR.SSA MAGALI STEINDLER & C. SAS,"Via Ponte delle Sette Miglia, 35",00173,Roma,Roma (RM),Lazio,F/9383,09394311006
MORREALE MARCO,"Via del Tritone, 16",00187,Roma,Roma (RM),Lazio,F/9234,09823070587
DIVINO AMORE SNC,"Via Davide Carazzi, 31",00134,Roma,Roma (RM),Lazio,F/9523,09823070587
SAN FRANCESCO DOTT.SSA FRANCESCA DONATI,"Via Valtellina, 94",00151,Roma,Roma (RM),Lazio,F/9610,12989621003
BONANZINGA VITTORIA,"Via Casilina, 1914/c",00132,Roma,Roma (RM),Lazio,F/9328,01219680830
DUE PINI DR.SSA GALLI MARIA ROSARIA,"Via del Golf, 12",00194,Roma,Roma (RM),Lazio,F/10484,07378321009
ANTICA FARMACIA TORRE ARGENTINA SAS DI BORBOTTI GIUSEPPINA,"Largo Arenula, 36",00186,Roma,Roma (RM),Lazio,F/9106,10017011007
SALUCCI ALDO,"Via Brennero, 24/26",00013,Fonte nuova,Roma (RM),Lazio,F/9909,10653101005
GABRIELE GIUSEPPE,"Via Roma, 14",00020,Ciciliano,Roma (RM),Lazio,F/9874,03642290716
BERTI ANNA,"Via IV Novembre, 97/B",00010,Montorio romano,Roma (RM),Lazio,F/9902,00052761004
CASE ROSSE DEL DOTT. GINALDO FRANCO E C. SAS,"Via Castropignano, 12",00131,Roma,Roma (RM),Lazio,F/9398,05192341005
QUADRINI DI REMO QUADRINI SAS,"Viale Vittorio Veneto, 4",00035,Olevano romano,Roma (RM),Lazio,F/9944,10233841005
MACCARESE DEL DR. ATTILIO MONETA CAGLIO DE SUVICH,"Piazza del Maccarese, 14/15",00057,Fiumicino,Roma (RM),Lazio,F/9568,01459980536
EREDI DR.SSA BOSCARINO LUCIA,"Via Chelini, 34 (Piazza Euclide)",00197,Roma,Roma (RM),Lazio,F/9194,13656371005
TORELLI SILVIA,"Via Portuense, 718",00148,Roma,Roma (RM),Lazio,F/9574,09847361004
ESQUILINO SNC-SCIARRA MARIA PIA,"Via Gioberti, 79",00185,Roma,Roma (RM),Lazio,F/9216,04377131000
F.LLI MATALONI LIVIO E GIULIANA SNC,"Via Marco Decumio, 18",00174,Roma,Roma (RM),Lazio,F/9379,05555961001
FABBRI CARLA RAFFAELLA,"Via Roma, 10",00060,Formello,Roma (RM),Lazio,F/9799,08754911009
Farmacia Facciolo Francesco,"Via Provinciale Carchitti, 33-33a",00036,Palestrina,Roma (RM),Lazio,F/9931,05241761005
PALERMO SAS DEL DR. ANTONINO PALERMO & C.,"Viale Francesco Caltagirone, 452",00132,Roma,Roma (RM),Lazio,F/9434,10668981003
FARMACIA SNC FANELLI SERENELLA,"Via Casalotti, 1/c 1/d",00166,Roma,Roma (RM),Lazio,F/9751,04765031002
VIZZACCARO SAS DELLA DR.SSA VIZZACCARO MARIA GRAZIA,"Viale Piave, 80",00030,San vito romano,Roma (RM),Lazio,F/9939,05762751005
SORRENTINO UGO,"Via Cassia, 840",00189,Roma,Roma (RM),Lazio,F/9696,12493391002
SAN MARCO DOTT. GIULIO PALMIERI,"Via Aosta, 89 Ang. Via Taranto, 60",00182,Roma,Roma (RM),Lazio,F/9437,08613161002
SAN GODENZO SAS DR. EMILIO GABELLA & C.,"ViaCassia, 534",00189,Roma,Roma (RM),Lazio,F/9705,10736391003
ARAMINI ANNA E MARIO SNC,"Piazza del Gesu', 13",00044,Frascati,Roma (RM),Lazio,F/9963,09169921005
ARRIGHI DEL DR. LUIGI NAVA,"Via Avicenna, 8/10",00146,Roma,Roma (RM),Lazio,F/9567,07526681007
SANT'ANNA - ARRIGHI PAOLA,"Largo Enea Bortolotti, 1",00146,Roma,Roma (RM),Lazio,F/9447,04808300588
ARTEMISIA DEL DR. ANGELO MONTECUOLLO SNC,"Via Lata, 241",00049,Velletri,Roma (RM),Lazio,F/9941,10747041001
BACECCI CINZIA,"Via Trento e Trieste, 36/38",00030,Genazzano,Roma (RM),Lazio,F/9896,00001791003
BAGNI PATRIZIA,"Piazza Matteotti, 6",00013,Mentana,Roma (RM),Lazio,F/9942,04141401002
BASTA FRANCESCO VITTORIO DI BASTA FRANCESCO VITTORIO & C S.A.S.,"Piazza Roselle, 1",00179,Roma,Roma (RM),Lazio,F/9560,13116051007
PONTELUNGO SAS DI ANDREA BARTOLE,"Piazza Finocchiaro Aprile, 13/14",00181,Roma,Roma (RM),Lazio,F/9449,09208911009
BARTOLOMUCCI ROBERTA FRANCESCA S.A.S.,"Largo Genova, 8",00040,Ardea,Roma (RM),Lazio,F/10044,12900761003
BARTULI MAURO,"Via Appia Nuova, 405",00181,Roma,Roma (RM),Lazio,F/9415,09306111007
S. BASILIO,"Via Morrovalle, 10/16",00156,Roma,Roma (RM),Lazio,F/9288,08825451001
MAZZANTINI ALESSANDRA,"Via Sant'Angela Merici, 69",00162,Roma,Roma (RM),Lazio,F/9273,08289171004
BATTISTINI,"Viale dei Colli Portuensi, 475",00151,Roma,Roma (RM),Lazio,F/9653,06116831006
BROCCHIERI DI GIGLIOLA E LAURA BROCCHIERI SNC,"Via Taranto, 162",00182,Roma,Roma (RM),Lazio,F/9446,07016431004
BROCCHIERI UNO SNC DEL DR. RENATO BROCCHIERI & C.,"Corso Filippo Turati, 21",00034,Colleferro,Roma (RM),Lazio,F/9850,11459691009
BUONFANTINO DI MARCO MORELLI,"Viale del Vignola, 4",00060,Sant'oreste,Roma (RM),Lazio,F/9810,13668061008
CANTU' DOTT. BORYSOWICZ STEFANO,"Piazza C. Cantu', 2",00181,Roma,Roma (RM),Lazio,F/9553,06666191009
CARAFA EMIDIO,"Via Belardi, 17",00045,Genzano di roma,Roma (RM),Lazio,F/10022,04660391006
CARAFA JACOBINI FEDERICA,"Via Matteotti, 7",00044,Frascati,Roma (RM),Lazio,F/10005,08762601006
CARNOVALE FABRIZIO,"Via Pisino, 81/83 ang. Via Serenissima, 56",00177,Roma,Roma (RM),Lazio,F/9476,08803940587
CARRELLO MARIA,"Via Cavour, 73",00033,Cave,Roma (RM),Lazio,F/9894,07440930589
FINOCCHI VALENTINA,"Via Livio Mariani, 8",00020,Marano equo,Roma (RM),Lazio,F/9854,01989270663
PORTUENSE,"Via Portuense, 423",00149,Roma,Roma (RM),Lazio,F/9576,02111790586
MEDIATI DR.SSA MARIA GRAZIA,"Via Castelforte, 29",00171,Roma,Roma (RM),Lazio,F/9534,13400561000
CAVALLINI MARIA TERESA,"Via Vivaldi, snc",00052,Cerveteri,Roma (RM),Lazio,F/9821,04048781001
CECCARELLI MARIA GRAZIA,"Via Bartolo Longo, 7",00156,Roma,Roma (RM),Lazio,F/9356,09457540582
CELLI SAS,"Viale Carlo Marx, 195",00137,Roma,Roma (RM),Lazio,F/9331,11495281005
TARQUINI SNC DELLA DR.SSA ESTERINA TARQUINI,"Via Polo Laziale, 12/16",00055,Ladispoli,Roma (RM),Lazio,F/9820,10184581006
ALBANESE MARIA NICOLETTA,"Viale Alessandrino, 273",00172,Roma,Roma (RM),Lazio,F/9386,10852440584
ALIQUO' FRANCESCO,"Via Piagge, 20",00020,Pisoniano,Roma (RM),Lazio,F/9938,05707031000
AMOROSO SACCHETTA GIOVANNI,"Via G. Branca, 62",00153,Roma,Roma (RM),Lazio,F/9082,01241670585
ANGELINI LINO,"Via Numitore, 9/11",00181,Roma,Roma (RM),Lazio,F/9412,00449610583
ANGELINI MARIANO,"Piazza S. Giovanni Bosco, 39/42",00175,Roma,Roma (RM),Lazio,F/9324,05140350587
ANNIA REGILLA,"Via A. Regilla, 103/105",00178,Roma,Roma (RM),Lazio,F/9368,05199381004
FLORIO MARIASSUNTA,"Via Radicofani, 147",00138,Roma,Roma (RM),Lazio,F/9185,07737160585
FORCELLESE LUCIA,"Via Casola Valsenio, 10",00127,Roma,Roma (RM),Lazio,F/9480,09274211003
FRANCHI DI ADA FRANCHI & C. SNC,"Via Tuscolana, 182-184-186 ang. Largo Saluzzo, 1",00182,Roma,Roma (RM),Lazio,F/9426,08559201002
TRASTEVERE DI LUCIANA FRANCONE & C. SNC,"Viale Trastevere, 80/f",00153,Roma,Roma (RM),Lazio,F/9171,09161691002
FRATELLI MARCHETTI SNC,"Piazza dei Mirti, 1",00172,Roma,Roma (RM),Lazio,F/9291,04356811002
GALASSI SAS,"Via Ardeatina, 170",00042,Anzio,Roma (RM),Lazio,F/10002,11495021005
GALENO DI PASQUALE CATALANO SNC,"Via Cogoleto, 100/102",00168,Roma,Roma (RM),Lazio,F/9745,09157191009
GALEPPI VITO,"Via Acaia, 49",00183,Roma,Roma (RM),Lazio,F/9403,00423850585
GALIMI WALTER,"Via Val di Cogne, 4",00141,Roma,Roma (RM),Lazio,F/9189,08138190585
GALLO SILVIA,"Piazza Castrolibero, 18 (Ang.Via Rocca Imperiale)",00040,Roma,Roma (RM),Lazio,F/9402,07264751004
APPIO D.SSA BARBARA GAONI,"Via Appio Claudio, 306",00174,Roma,Roma (RM),Lazio,F/9393,06283221007
GAONI DI PAOLO E ROBERTA GAONI SNC,"Viale Medaglie D'Oro, 417",00136,Roma,Roma (RM),Lazio,F/9768,04676731005
GAONI RAFFAELLA,"Via Tommaso da Celano, 27/c",00179,Roma,Roma (RM),Lazio,F/9506,12661241005
GARSIA EDDA,"Via Tibero Imperatore, 53",00145,Roma,Roma (RM),Lazio,F/9430,01414110583
CICERONE PIETRO,"Via Ostiense, 53",00154,Roma,Roma (RM),Lazio,F/9524,13945781006
GIDIUCCI MARISA,"Via IV Novembre, 8",00010,Monteflavio,Roma (RM),Lazio,F/9899,00322811001
GIMIGLIANO ANNA,"Via Giacomo Biga, 10",00154,Roma,Roma (RM),Lazio,F/9456,07761331003
GIORDANI PIERMARINO,"Piazza Farnese, 42",00186,Roma,Roma (RM),Lazio,F/9235,09885280587
GIORGI GIANFRANCO,"Via Massa di S. Giuliano, 260",00010,Roma,Roma (RM),Lazio,F/9329,00349401000
GIOVANNOLA FABRIZIO,Via Campolimpido di Tivoli,00019,Tivoli,Roma (RM),Lazio,F/9927,04873791000
GIROTTI FILIPPO,"Via Alessandria, 101",00198,Roma,Roma (RM),Lazio,F/9245,10124950584
TOMA DELLA DR.SSA GRAZIOSI ALESSANDRA,"Via delle Baleniere, 139",00121,Roma,Roma (RM),Lazio,F/9658,06427251001
CERNUSCO GIULIANA,"Via Buonarroti, 42",00053,Civitavecchia,Roma (RM),Lazio,F/9822,04127941005
CHIMENTI BRUNO,"Via Migiurtina, 43/45",00199,Roma,Roma (RM),Lazio,F/9101,00949980585
CIANCI GIUSEPPE,"Via Polia, 12-14",00178,Roma,Roma (RM),Lazio,F/9334,07738870588
CIOTTI ALESSANDRA,"Piazza di Trevi, 89",00187,Roma,Roma (RM),Lazio,F/9100,09052501005
COCCI AMALIA MARIA VITTORIA,"Via Cassia, 1346/1348",00123,Roma,Roma (RM),Lazio,F/9700,05115770587
COLAPINTO SAS DR.SSA COLAPINTO FRANCESCA SOFIA,"Via Pietro Maffi, 74 A e B",00168,Roma,Roma (RM),Lazio,F/9682,09204301007
COLLI ALBANI,"Via Rocca Priora, 60",00179,Roma,Roma (RM),Lazio,F/9539,10887190584
PETITTO GIANLUIGI,"Via della Pisana, 370-Edificio E-Negozio A",00163,Roma,Roma (RM),Lazio,F/9596,05719880584
IPPOCRATE SRL - CALAMATTA,"Piazza Calamatta, 19",00053,Civitavecchia,Roma (RM),Lazio,F/9808,10648161007
Pisanti Adriano,"Piazza C. Battisti, 16",00037,Segni,Roma (RM),Lazio,F/9903,01461060622
DAGUI' SILVESTRO,"Via Giuseppe De Nava, 9",00139,Roma,Roma (RM),Lazio,F/9226,09667180583
D'ALESSANDRO SILVIA,"Via dei Malatesta, 5 a/b",00164,Roma,Roma (RM),Lazio,F/9645,10480660587
DAVANZO FRANCESCO,"Via Ponzio Cominio, 29/a - 29/b",00175,Roma,Roma (RM),Lazio,F/9358,09608940582
IPPOCRATE SNC DI FRANCESCO MARIA DE BELLA E C.,"Via D. Morichini, 24/26",00161,Roma,Roma (RM),Lazio,F/9108,12668721009
DE BERARDINIS MARIO,"Via Pescaglia, 29",00146,Roma,Roma (RM),Lazio,F/9619,09245800587
DE CESARIS EMILIA,"Via S. Giovanni Bosco, 91",00175,Roma,Roma (RM),Lazio,F/9366,09640880580
DE MARCHIS ALESSANDRO,"Corso Matteotti, 132",00041,Albano laziale,Roma (RM),Lazio,F/10021,04656471002
DE MICHELE SERGIO,"Piazza S. Giovanni, 37",00014,Guidonia montecelio,Roma (RM),Lazio,F/9906,08710440580
DELLE ROBINIE SAS DI DI GIACOMANTONIO FRANCO & C.,"Via delle Robinie, 81-81a",00172,Roma,Roma (RM),Lazio,F/9401,08423181000
LUIGI DEMICHELIS DAL 1934,"Via Ancona, 76",00055,Ladispoli,Roma (RM),Lazio,F/9793,13040531009
CENTRALE SAS DI SCHIAPPA ANTONIO & C.,"Via Garibaldi, 2",00028,Subiaco,Roma (RM),Lazio,F/9897,07908661007
DESSI,"Via Tuscolana, 991",00174,Roma,Roma (RM),Lazio,F/9384,10658660583
DI CECCO DELLA DR.SSA DI CECCO GIUSTINIANA & C. SAS,"Via S. Maria, 1",00029,Vicovaro,Roma (RM),Lazio,F/9864,06951681003
PONZI ENNIO SAS,"Piazza Massa Carrara, 9",00162,Roma,Roma (RM),Lazio,F/9135,10182371004
PONZI ENNIO SAS,"Via di Torrenova, 155/d",00133,Roma,Roma (RM),Lazio,F/9347,10182371004
